{
  "award_id": "aw_2025_kda",
  "version": "1.0.0",
  "criteria": [
    {
      "id": "C1",
      "label": "시각적 계층(Visual Hierarchy)",
      "description": "타이포 크기/무게/위치 기반 주목도",
      "scale": {"type": "int", "min": 1, "max": 5},
      "weight": 0.25,
      "guideline_refs": ["§2.1", "§2.2", "§2.3"],
      "evidence_queries": ["hierarchy", "typographic scale", "contrast"],
      "visibility": {"show_model_suggestion_after_initial_score": true}
    },
    {
      "id": "C2",
      "label": "구성·레이아웃(Composition & Layout)",
      "description": "그리드/여백/정렬",
      "scale": {"type": "int", "min": 1, "max": 5},
      "weight": 0.25,
      "guideline_refs": ["§3.1", "§3.2"],
      "evidence_queries": ["grid", "white space"]
    },
    {
      "id": "C3",
      "label": "접근성(Accessibility)",
      "description": "대비·대체텍스트",
      "scale": {"type": "int", "min": 1, "max": 5},
      "weight": 0.25,
      "guideline_refs": ["§4.1", "§4.2"],
      "required_checks": ["color_contrast", "alt_text_presence"]
    },
    {
      "id": "C4",
      "label": "브랜딩 일관성(Brand Consistency)",
      "description": "팔레트/로고/톤",
      "scale": {"type": "int", "min": 1, "max": 5},
      "weight": 0.25,
      "guideline_refs": ["§5.1", "§5.2"]
    }
  ],
  "aggregation": {"method": "weighted_mean", "outlier_policy": "trim_10"}
}
